{
  "id": "loose_reed_006",
  "modelName": "MiniSax",
  "modelVersion": "0.1.0",
  "createdAt": "2026-07-09",
  "author": "Alex Enkerli / ChatGPT",
  "derivedFrom": "breathy_001",
  "gitCommit": null,
  "description": "Loose, open reed configuration with stronger breath noise and easier low-pressure response.",
  "reason": "Contrast reed aperture/stiffness against bright_lead_005 while retaining a broadly similar output level.",
  "parameters": {
    "breath": 0.5,
    "embouchure": 0.36,
    "reedStiffness": 0.38,
    "reedAperture": 0.7,
    "boreDamping": 0.3,
    "bellBrightness": 0.48,
    "noiseAmount": 0.13,
    "growlAmount": 0.0,
    "vibratoAirAmount": 0.0,
    "vibratoPitchAmount": 0.0,
    "outputGain": 0.86
  },
  "observations": [
    "Candidate preset only; render and descriptor review required before musical acceptance.",
    "Parameters remain within the existing v0.1 schema and engine controls."
  ],
  "tags": [
    "loose-reed",
    "open",
    "breathy",
    "contrast"
  ]
}
